question,answer,category
What medical facilities are available at GNITS?,The medical center provides general consultation, first aid, emergency care, and dispensary services. A doctor visits daily and a full-time nurse is available.,facilities
Is there an ATM on GNITS campus?,Yes. An SBI ATM is located near the main gate campus entrance and is available 24/7.,facilities
Is WiFi available on GNITS campus?,Yes. The entire campus has high-speed WiFi coverage. Students can connect up to 2 devices using their student ID credentials.,facilities
What is the seating capacity of GNITS Auditorium?,The GNITS Auditorium has a seating capacity of 1000 students. It is air-conditioned with modern audio-visual systems.,facilities
How many computer labs does GNITS have?,GNITS has 10 computer labs with over 600 systems. Labs are open 9:00 AM to 5:00 PM and extend to 8:00 AM to 6:00 PM during exams.,facilities
Is there a canteen at GNITS?,Yes. The main college canteen serves breakfast, lunch, snacks, and dinner at subsidized rates. It offers both South Indian and North Indian food.,facilities
What are the canteen timings at GNITS?,Breakfast: 7:30 AM to 9:00 AM, Lunch: 12:00 PM to 2:30 PM, Snacks: 4:00 PM to 6:00 PM, Dinner for hostel students: 7:30 PM to 9:00 PM.,facilities
Where is the placement cell at GNITS?,The Training and Placement Cell is at the Administrative Block Ground Floor Room G1. Contact: tpo@gnits.ac.in or 040-23004092.,facilities
Is there an auditorium at GNITS?,Yes. The GNITS Auditorium with 1000 seat capacity is located at the Central Campus Main Block. It can be booked through the administration office.,facilities
Does GNITS have seminar halls?,Yes. Multiple seminar halls with 60 to 120 seat capacity are available across all department blocks with projector and audio facilities.,facilities
How do I contact the GNITS principal?,Contact the principal at principal@gnits.ac.in or call 040-23004000. Office is at the Administrative Block.,faculty
How do I contact a specific faculty member at GNITS?,Faculty contact details including email and phone are available on the GNITS website at gnits.ac.in/faculty or from the respective department office.,faculty
Who is the CSE department faculty coordinator for coding club?,The faculty coordinator for the Coding Club is Ms. T. Pavani from the CSE department.,faculty
Who is the registrar at GNITS?,The Registrar at GNITS is Mr. P. Ramakrishna. Contact: registrar@gnits.ac.in or 040-23004090.,faculty
How many faculty members are there in GNITS CSE department?,The CSE department has 7 faculty members including the HOD, professors, associate professors, and assistant professors.,faculty
How do I meet the college principal?,Meet the principal by scheduling an appointment through the administrative office or contacting principal@gnits.ac.in.,faculty
Can I email faculty directly?,Yes. All faculty have official GNITS email addresses in the format name@gnits.ac.in. Contact details are available from department offices.,faculty
Is ragging allowed at GNITS?,Absolutely not. GNITS has zero tolerance for ragging. Any form of ragging leads to immediate disciplinary action including expulsion and police complaints.,academics
What is the anti-ragging helpline number?,The national anti-ragging helpline number is 1800-180-5522 (toll free). You can also report at arc@gnits.ac.in.,academics
What is the POSH policy at GNITS?,GNITS has a robust Prevention of Sexual Harassment (POSH) policy. The Internal Complaints Committee handles complaints at icc@gnits.ac.in. All complaints are confidential.,academics
How do I raise a grievance at GNITS?,Submit grievances online at gnits.ac.in/grievance or escalate through class teacher then HoD then Dean then Principal. All grievances are acknowledged within 3 days.,academics
Is there a student counselor at GNITS?,Yes. Every student is assigned a faculty counselor at the start of each academic year for academic and personal guidance. Professional psychological counseling is also available.,academics
What scholarships are available for students at GNITS?,Available scholarships include Telangana Fee Reimbursement (BC/SC/ST), Post Matric Scholarship, Minorities Scholarship, EBC Scholarship, and GNITS merit scholarships.,academics
How do I apply for fee reimbursement in Telangana?,Apply through the Telangana ePASS portal (telangana.gov.in/scholarship) with income certificate and caste certificate. Deadlines announced at start of academic year.,academics
What is the security contact number at GNITS?,The 24/7 security contact number is 040-23004199.,facilities
How do I register for college events at GNITS?,Most events have registration links on gnits.ac.in/events or through the organizing department. Fees and deadlines vary by event.,events
Can outsiders attend GNITS events?,Some events like TechFest and Cultural Fest are open to participants from other colleges. Registration is required and announced on the GNITS website.,events
What is GNITS full form?,GNITS stands for G. Narayanamma Institute of Technology and Science.,admissions
Is GNITS a private college?,Yes. GNITS is a private self-financing engineering college established in 1997.,admissions
Is GNITS AICTE approved?,Yes. GNITS is approved by AICTE (All India Council for Technical Education).,admissions
What is the medium of instruction at GNITS?,The medium of instruction at GNITS is English.,academics
Does GNITS have a placement guarantee?,GNITS does not guarantee placements but has a strong T&P Cell that helps students secure jobs. The placement percentage is approximately 85%.,placements
What coding languages should I learn for placements?,Learn C, C++, Java, or Python as primary languages. Focus on DSA, SQL, and Operating Systems concepts for technical interviews.,placements
What aptitude resources should I use for placement preparation?,Recommended resources include RS Aggarwal Quantitative Aptitude, Arun Sharma, IndiaBIX website, and regular practice on LeetCode and HackerRank.,placements
Can final year students stay in hostel?,Yes. Final year students can stay in the hostel until the end of their academic year including examination period.,hostel
What is the hostel admission fee?,The one-time hostel admission fee is Rs. 1,000 in addition to the security deposit.,hostel
Can I change my room in the hostel?,Room change requests can be submitted to the warden. Changes are accommodated subject to availability and valid reasons.,hostel
What if there is a medical emergency in the hostel at night?,Contact the warden on duty immediately. The warden has emergency contacts and ambulance arrangements. Security is also available 24/7 at 040-23004199.,hostel
What is the GNITS email domain?,GNITS email addresses use the domain @gnits.ac.in.,faculty
Does GNITS have any rankings?,GNITS is NAAC accredited and is recognized among the top women's engineering colleges in Telangana and Andhra Pradesh.,admissions
How many students are enrolled at GNITS?,GNITS has approximately 2000+ students across all programs and years.,admissions
What is the student to faculty ratio at GNITS?,GNITS maintains a good student to faculty ratio across departments to ensure quality education.,academics
Is there bus facility for day scholars at GNITS?,GNITS has transport facilities. Contact the college administration for current bus routes and timings.,facilities
How do I get a duplicate ID card?,Report to the student affairs office, fill the application form, pay the duplicate ID card fee, and collect within 3 working days.,academics
What are the college holiday dates?,GNITS follows JNTUH academic calendar. Key holidays include national holidays, Diwali, Dussehra, Sankranti, Ramzan, and other state holidays. Calendar published at start of year.,academics
Does GNITS have a separate library for each department?,Each department has a small departmental library in addition to the central library. The Central Library is the main resource center.,library
What is the fine if I write in a library book?,Writing or marking in a library book results in a minimum fine of Rs. 100 plus damage assessment.,library
Can I access library resources from home?,Some digital resources like N-LIST may require campus network. NPTEL is publicly accessible. Check with library for VPN access options.,library
What is the exam schedule for B.Tech?,JNTUH releases the exam schedule on jntuh.ac.in approximately 3 to 4 weeks before exams. It is also displayed on the GNITS notice board.,academics
How do I check my exam results?,JNTUH results are published on jntuh.ac.in. Login with your hall ticket number to view results.,academics
What is the process for re-evaluation of answer sheets?,Apply for re-evaluation through JNTUH website within the notified period after results. A fee is applicable per subject.,academics
Where can I find the JNTUH syllabus?,JNTUH syllabus is available on jntuh.ac.in under academics section. It is also available from your department office.,academics
Is there project work in B.Tech?,Yes. B.Tech final year students undertake a major project worth 6 credits. Internal project and external viva are conducted.,academics
What is the seminar requirement for M.Tech?,M.Tech students are required to present seminars on technical topics as part of their academic evaluation.,academics
Can day scholars use the library?,Yes. All enrolled students including day scholars have library membership and can use all library facilities.,library
Is there a canteen inside the college for day students?,Yes. The main college canteen serves all students including day scholars. Subsidized rates are available.,facilities
What should I do if I lose my college ID card?,Report immediately to the student affairs office, fill a loss report, pay a duplicate fee, and collect your new ID card.,academics
What is the process to get transcripts from GNITS?,Apply for transcripts at the examination section in the administrative block with required fee. Processing takes 7 to 10 working days.,academics
Can I transfer from another college to GNITS?,Lateral entry transfers are possible subject to seat availability and JNTUH norms. Contact the admissions office for details.,admissions
Does GNITS have a placement cell WhatsApp group?,Yes. Final year registered students are added to T&P Cell communication groups. Register with placement cell to be included.,placements
What companies does GNITS have MoU with?,GNITS has MoUs with several IT companies and industry partners for training, internships, and placements. Details available from T&P Cell.,placements
